{"inputs":[{"annotations":{"network.jinn.confidential/classification":"restricted"},"digest":{"sha256":"11323200ef5c2cc97e22ef3122585805922c7be15c49d5d2872d1b10c1341751"},"name":"confidential-repository"}],"instructions":"Work against a confidential input the requester controls access to.","outputs":[{"mediaType":"text/x-diff","name":"patch","required":true}],"profile":{"digest":{"sha256":"3917f0428b2626fd2cc93675172731cc000b69d7d783f9adaf5159be56fd10a6"},"uri":"https://jinn.network/task-profiles/repository-work/1.0"},"protocol":"https://jinn.network/profiles/task-execution/1.0"}