{"instructions":"Normalize the slug helper and add a regression test.","outputs":[{"mediaType":"text/x-diff","name":"patch","required":true}],"profile":{"digest":{"sha256":"3917f0428b2626fd2cc93675172731cc000b69d7d783f9adaf5159be56fd10a6"},"uri":"https://spec.jinn.network/task-profiles/repository-work/1.0"},"protocol":"https://spec.jinn.network/profiles/task-execution/v1","requirements":{"effort":"medium","maxAttemptDurationMs":600000}}