{"evaluation":{"digest":{"sha256":"751db975920fefb05c6acd68e2ec1574889df55549b7688796c31c1f7245b811"}},"inputs":[{"annotations":{"ref":"3333333333333333333333333333333333333333"},"name":"repository-state","uri":"https://github.com/acme/widget"}],"instructions":"Widget.rotate() drops the alpha channel.\n","outputs":[{"mediaType":"text/x-diff","name":"patch","required":true},{"mediaType":"text/markdown","name":"summary","required":false},{"mediaType":"application/json","name":"evidence","required":false}],"payload":{"instance_id":"acme__widget-1235","language":"python","provenance":{"kind":"mined","sourceCommitment":"sha256:6cd1df5199fe7c78ec97506aadc13a404d524df264f2453d9c14cfe3df7b100b"},"rights":{"sourceLicense":"MIT"}},"profile":{"digest":{"sha256":"4a920949b7c6f7eea430ca0b8aca530db10135b967638dc5869734dd5bb51ec5"},"uri":"https://spec.jinn.network/task-profiles/repository-work/1.0"},"protocol":"https://spec.jinn.network/profiles/task-execution/v1"}