{"evaluation":{"digest":{"sha256":"b1d5082a8bbb228e0b7dfd86006077afbde28e6f23ea3a636423e3d7278c81af"}},"inputs":[{"annotations":{"ref":"3333333333333333333333333333333333333333"},"name":"repository-state","uri":"https://github.com/acme/widget"}],"instructions":"Widget.resize() raises on zero width.\n\nExpected: returns 0.\n","outputs":[{"mediaType":"text/x-diff","name":"patch","required":true},{"mediaType":"text/markdown","name":"summary","required":false},{"mediaType":"application/json","name":"evidence","required":false}],"payload":{"instance_id":"acme__widget-1234","language":"python","provenance":{"kind":"mined","sourceCommitment":"sha256:ff2001f4954b8522193295e4f0573a747c88afbf152231da6a2d4004738e04e4"},"rights":{"sourceLicense":"Apache-2.0"}},"profile":{"digest":{"sha256":"829c28d91e324098739bcd6dfd3e32f7c6902efd737333c8f5659dc354a0475a"},"uri":"https://jinn.network/task-profiles/repository-work/1.0"},"protocol":"https://jinn.network/profiles/task-execution/1.0"}