{"evaluation":{"digest":{"sha256":"2d5703421176e392e7fd918439dc90f1de427c3dd83c785332afa9bfd90d23c7"}},"inputs":[{"annotations":{"ref":"3333333333333333333333333333333333333333"},"name":"repository-state","uri":"https://github.com/acme/widget"}],"instructions":"Widget.resize() raises on zero width.\n\nExpected: returns 0.\n","outputs":[{"mediaType":"text/x-diff","name":"patch","required":true},{"mediaType":"text/markdown","name":"summary","required":false},{"mediaType":"application/json","name":"evidence","required":false}],"payload":{"instance_id":"acme__widget-1234","language":"python","provenance":{"kind":"mined","sourceCommitment":"sha256:ff2001f4954b8522193295e4f0573a747c88afbf152231da6a2d4004738e04e4"},"rights":{"sourceLicense":"Apache-2.0"}},"profile":{"digest":{"sha256":"4a920949b7c6f7eea430ca0b8aca530db10135b967638dc5869734dd5bb51ec5"},"uri":"https://spec.jinn.network/task-profiles/repository-work/1.0"},"protocol":"https://spec.jinn.network/profiles/task-execution/v1"}